{"schema_version":"1.0.0","review_id":"review-ep001","project_id":"novel_example","task_id":"draft-ep001","draft_path":"tests/fixtures/sample_manuscript.txt","final_path":"tests/fixtures/style_audit_sample.txt","context_used":[{"source_id":"story_bible:canon-001","source_version":"0.1.0","source_hash":"sha256:example"}],"component_versions":{"workflow":"1.15.0","episode_writer":"1.15.0","context_router":"1.2.0"},"checks":{"grounding":"pass","canon":"pass","character_state":"pass","continuity":"pass","style":"pass","engagement_contract":"pass"},"uncertainties":[],"review_questions":[],"human_outcome":{"status":"edited_and_approved","reviewed_at":"2026-06-20T00:00:00Z","reviewer":"author"}}
